{
  "$schema": "https://json-schema.org/draft/2020-12/schema",
  "$id": "https://wazir.dev/schemas/verification-proof.schema.json",
  "title": "Verification Proof Artifact",
  "type": "object",
  "required": ["phase", "role", "run_id", "created_at", "sources", "status", "loop_number", "commands"],
  "properties": {
    "phase": { "const": "verify" },
    "role": { "const": "verifier" },
    "run_id": { "type": "string", "minLength": 1 },
    "created_at": { "type": "string", "format": "date-time" },
    "sources": { "type": "array", "items": { "type": "string" } },
    "status": { "type": "string", "minLength": 1 },
    "loop_number": { "type": "integer", "minimum": 0 },
    "commands": {
      "type": "array",
      "items": {
        "type": "object",
        "required": ["command", "exit_code"],
        "properties": {
          "command": { "type": "string", "minLength": 1 },
          "exit_code": { "type": "integer" }
        },
        "additionalProperties": true
      }
    }
  },
  "additionalProperties": true
}
